id	date	title	link	status	phrase	topic
1121	April 10, 2022	Russian servicemen have carried out 12 humanitarian actions in Donbass and Ukraine over the past 24 hours	https://www.1tv.ru/news/2022-04-10/426089-rossiyskie_voennosluzhaschie_za_poslednie_sutki_proveli_12_gumanitarnyh_aktsiy_v_donbasse_i_na_ukraine	normal	carried out humanitarian actions	Russian military
14	April 24, 2022	The latest information on the course of the special operation to protect Donbass from the Ministry of Defense of the Russian Federation	https://www.1tv.ru/news/2022-04-24/427238-poslednyaya_informatsiya_o_hode_spetsoperatsii_po_zaschite_donbassa_ot_minoborony_rf	normal	for the protection of Donbass	special operation
64	April 23, 2022	Russian military heroically perform combat missions during a special operation in Ukraine	https://www.1tv.ru/news/2022-04-23/427184-rossiyskie_voennye_geroyski_vypolnyayut_boevye_zadachi_v_hode_spetsoperatsii_na_ukraine	normal	in Ukraine	special operation
1296	April 7, 2022	The new names of the heroes who are fighting during the special operation for peace in the Donbass have become known	https://www.1tv.ru/news/2022-04-07/425907-stali_izvestny_novye_imena_geroev_kotorye_srazhayutsya_v_hode_spetsoperatsii_za_mir_v_donbasse	normal	for peace in Donbass	special operation
1354	April 7, 2022	FSB officers conducted a special operation in the Crimea	https://www.1tv.ru/news/2022-04-07/425847-sotrudniki_fsb_rf_proveli_spetsoperatsiyu_v_krymu	normal	in Crimea	special operation
4655	March 2, 2022	Sergey Lavrov stressed again that Russian special operation is aimed at the demilitarization of Ukraine	https://www.1tv.ru/news/2022-03-02/422434-sergey_lavrov_snova_podcherknul_chto_spetsoperatsiya_rossii_napravlena_na_demilitarizatsiyu_ukrainy	normal	Russian [special operation ] is aimed at the demilitarization of Ukraine	special operation
4820	March 1, 2022	S. Lavrov: the purpose of the special operation of the Russian Federation is to save people, demilitarize and denazify Ukraine	https://www.1tv.ru/news/2022-03-01/422245-s_lavrov_tsel_spetsoperatsii_rf_spasenie_lyudey_demilitarizatsiya_i_denatsifikatsiya_ukrainy	normal	the [ special operation ] of the Russian Federation is to save people, demilitarize and denazify Ukraine	special operation
5220	February 25, 2022	The President made a statement about the special operation aimed at protecting the DNR and LNR	https://www.1tv.ru/news/2022-02-25/421832-prezident_sdelal_zayavlenie_po_povodu_spetsoperatsii_napravlennoy_na_zaschitu_dnr_i_lnr	normal	aimed at protecting the DNR and LNR	special operation
5441	February 24, 2022	Vladimir Putin announced that Russia launched a special operation in the Donbass	https://www.1tv.ru/news/2022-02-24/421606-vladimir_putin_ob_yavil_chto_rossiya_nachala_spetsoperatsiyu_v_donbasse	normal	  in Donbass	special operation